{
  "$schema": "http://json-schema.org/draft-07/schema#",
  "$id": "https://github.com/himorishige/hatago-hub/schemas/config.schema.json",
  "title": "Hatago MCP Hub Configuration",
  "description": "Configuration schema for Hatago MCP Hub - Lightweight MCP server management",
  "type": "object",
  "properties": {
    "version": {
      "type": "number",
      "description": "Configuration version",
      "const": 1
    },
    "logLevel": {
      "type": "string",
      "description": "Logging level",
      "enum": [
        "debug",
        "info",
        "warn",
        "error"
      ],
      "default": "info"
    },
    "http": {
      "type": "object",
      "description": "HTTP server configuration",
      "properties": {
        "port": {
          "type": "number",
          "description": "Port to listen on",
          "default": 3000
        },
        "host": {
          "type": "string",
          "description": "Host to bind to",
          "default": "localhost"
        }
      }
    },
    "mcpServers": {
      "type": "object",
      "description": "MCP servers configuration",
      "additionalProperties": {
        "type": "object",
        "properties": {
          "type": {
            "type": "string",
            "enum": [
              "local",
              "remote"
            ],
            "description": "Server type"
          },
          "command": {
            "type": "string",
            "description": "Command to execute for local servers"
          },
          "args": {
            "type": "array",
            "items": {
              "type": "string"
            },
            "description": "Command arguments"
          },
          "url": {
            "type": "string",
            "description": "URL for remote servers"
          },
          "transport": {
            "type": "string",
            "enum": [
              "stdio",
              "http",
              "streamable-http",
              "sse"
            ],
            "description": "Transport type"
          },
          "env": {
            "type": "object",
            "additionalProperties": {
              "type": "string"
            },
            "description": "Environment variables"
          }
        }
      }
    }
  },
  "required": [
    "version"
  ]
}